{
  "@context": "https://concert.foundation/signet/v0.1/context.jsonld",
  "type": "Policy",
  "id": {
    "scheme": "did",
    "id": "did:web:buyer.example#policy-eval-mat"
  },
  "policyType": "evaluation",
  "expressionLanguage": "rego",
  "expression": "package signet.eval\nscore := price*0.2 + quality*0.55 + social*0.25",
  "humanReadable": "Most Advantageous Tender: price 20%, quality 55%, social value 25%.",
  "version": "1.1.0",
  "issuedBy": {
    "scheme": "did",
    "id": "did:web:buyer.example#buyer"
  }
}
